Question_ID,Questions,Answers,Preprocessed_Questions,Preprocessed_Answers,Sentiment
2746837,An adult in my life seems ill and won’t find help. What can I do?,"It’s difficult when an adult child, sibling, parent, friend, co-worker, or other important person is struggling or behaving in ways that are causing harm. This can be a tricky situation—you want to help, but most adults are responsible for their own care. 
 There are two important points to think about. First, diagnosing a health condition, especially when symptom-checking is so easy online, can be dangerous. Diagnosis is still always best left to professionals who can look at the whole picture. Remember, too, that the person you care about may have a very different idea of what’s causing their difficulties and what the negative impacts are on their life. Second, except in rare cases, the person being treated needs to be an active player in their own recovery to continue with their treatment, just as they would for any other health problem. If the vast majority of cases, you cannot do this work entirely for them—and trying to do so may damage your relationship. 
 Be honest about your concerns, the impacts you are seeing that worry you, listen to their point of view and work together to find a solution that works for everyone, even if it means a compromise. You may want to offer to go with them to an appointment, encourage them to do an online screening self-test, or involve someone else close to them who may be similarly concerned and may have more influence in encouraging them to notice changes and seek help. Because you may be feeling frustrated and helpless, it’s important to get care and support for yourself during this time, especially if you’re very close to the person you’re worried about. 
 In serious situations, the BC Mental Health Act allows someone to be held for a period of time for psychiatric assessment without their consent if they are at risk of harming themselves or others. While it’s necessary in some situations to get someone the care they need, it can be traumatic for everyone involved. For more on the BC Mental Health Act, see the Guide to the Mental Health Act.",adult life seems ill ’ find help,’ difficult adult child sibling parent friend co-worker important person struggling behaving ways causing harm tricky situation—you want help adults responsible care two important points think first diagnosing health condition especially symptom-checking easy online dangerous diagnosis still always best left professionals look whole picture remember person care may different idea ’ causing difficulties negative impacts life second except rare cases person treated needs active player recovery continue treatment would health problem vast majority cases work entirely them—and trying may damage relationship honest concerns impacts seeing worry listen point view work together find solution works everyone even means compromise may want offer go appointment encourage online screening self-test involve someone else close may similarly concerned may influence encouraging notice changes seek help may feeling frustrated helpless ’ important get care support time especially ’ close person ’ worried serious situations bc mental health act allows someone held period time psychiatric assessment without consent risk harming others ’ necessary situations get someone care need traumatic everyone involved bc mental health act see guide mental health act,neutral
5640861,I’m worried about my child or teenager. Where can I find help?,"It can be hard to figure out what to do if you’re concerned about a young person in your family. Many people start by talking with their family doctor. If you don’t have a family doctor, you can find a doctor through the College of Physicians and Surgeons of BC. You can also visit a walk-in clinic. Depending on the situation, your family doctor may offer everything you need. If your child needs more specialized services, such as psychiatry services, your family doctor needs to make a referral for your child. Many family doctors can also recommend community services or supports in your community. Learn more about the role of family doctors in the info sheet What to Expect from Your Family or Walk-In Clinic Doctor. 
 If your child’s difficulties affect their performance or behaviour at school, the school may be involved. If your child’s school has a counsellor, talk to them about services you can access through the school. School counsellors can also suggest community services. See the info sheet What to Expect from Your Child's School. 
 Kelty Mental Health Resource Centre offers information, resources, peer support, and system navigation to children, youth, and families experiencing mental health or substance use challenges. Their Help Finder tool and help you navigate the mental health system. Kelty Mental Health is based at BC Children’s Hospital in Vancouver, but they support young people and their families across the province. 
 Institute of Families for Child and Youth Mental Health advocates for healthy young people and family support. They offer resources and education events across BC. 
 The Canadian Mental Health Association’s BC Division offers Confident Parents: Thriving Kids, a phone-based education and support program to help parents or caregivers manage mild to moderate behaviour problems for children ages 3 to 12. This program is free, but it requires a doctor’s referral. 
 You may also want to check out these resources from HeretoHelp on child and youth mental health and substance use:",’ worried child teenager find help,hard figure ’ concerned young person family many people start talking family doctor ’ family doctor find doctor college physicians surgeons bc also visit walk-in clinic depending situation family doctor may offer everything need child needs specialized services psychiatry services family doctor needs make referral child many family doctors also recommend community services supports community learn role family doctors info sheet expect family walk-in clinic doctor child ’ difficulties affect performance behaviour school school may involved child ’ school counsellor talk services access school school counsellors also suggest community services see info sheet expect child 's school kelty mental health resource centre offers information resources peer support system navigation children youth families experiencing mental health substance use challenges help finder tool help navigate mental health system kelty mental health based bc children ’ hospital vancouver support young people families across province institute families child youth mental health advocates healthy young people family support offer resources education events across bc canadian mental health association ’ bc division offers confident parents thriving kids phone-based education support program help parents caregivers manage mild moderate behaviour problems children ages 3 12. program free requires doctor ’ referral may also want check resources heretohelp child youth mental health substance use,positive
3393534,Someone I care about has a brain injury. Where can I find more information?,"A brain injury itself isn’t the same as a mental illness, though someone who experiences a brain injury may also experience mental health problems. These mental health problems may stem from the injury itself or from thoughts around the injury (like feelings of loss, anger, or frustration when quality of life changes). In some cases, mental health challenges may not be related to a brain injury at all. The good news is that mental health problems are treatable, even if you or someone you care about has experienced a brain injury. It may be helpful to find a service provider who is familiar with both brain injuries and mental health. 
 For more information and support, visit the BC Brain Injury Association. You can also find local and regional groups and organizations in BC through the Brain Injury Association of Canada.",someone care brain injury find information,brain injury ’ mental illness though someone experiences brain injury may also experience mental health problems mental health problems may stem injury thoughts around injury like feelings loss anger frustration quality life changes cases mental health challenges may related brain injury good news mental health problems treatable even someone care experienced brain injury may helpful find service provider familiar brain injuries mental health information support visit bc brain injury association also find local regional groups organizations bc brain injury association canada,positive
3839472,Someone I love has been diagnosed with depression. How can I help?,"We naturally want to help a loved one who isn’t feeling well. How we can or should help may seem fairly obvious when a loved one experiences a physical health problem, but many people say they’re not sure how to best help when a loved one experiences a mental illness like depression. Here are some tips: 
 You don’t have to understand exactly what someone else is experiencing, you just need to recognize that it’s a difficult experience. You can try something like, “I can see that this experience or these symptoms are really painful for you,” or, “I’m sorry to hear that you’re feeling unwell.” If you have experienced depression yourself, you might say, “I know how you feel.” Just remember that everyone experiences illnesses like depression differently, and empathy is about recognizing the impact of the illness, not comparing symptoms. 
 You don’t have to be an expert, but learning more about depression can help you understand what’s going on (and maybe dispel some of the unhelpful myths around depression). Our Depression info sheet is a great place to start, and we have a list of resources at Q&A: Where can I learn more about depression? 
 Sometimes talking about problems or concerns can really help—in fact, many people who experience a mood disorder say that they just want to be heard. It’s important to understand that talking about something difficult like experiences of depression can be very hard for your loved one. You cannot force them to talk about it, but you can invite them to, and create safe and quiet spaces to talk. If a loved one opens up to you, listen actively—that is, without distractions like your phone or the TV. Really pay attention to what they have to say. Listen with empathy and without judgement. Even if you don’t understand the problem or see the problem in a different way, your main concern is the distress or difficult feelings your loved one is experiencing. You can find in-depth tips on listening and communicating well in Module Three of the Family Toolkit. Some people are not ready to talk about everything at once, or at all. That’s okay! Respect your loved one’s boundaries and let them tell you what they’re ready to talk about. 
 Even when you have the best intentions, unsolicited advice can be unhelpful. You likely can’t fix the problem, and you may not know the whole story. If you’d like to share what worked for you in a similar situation, you can ask if the other person would like to talk about strategies that worked for you. 
 Different people need different things—don’t assume you know what’s best! Some people need emotional help, like someone they can talk with. Other people may have a good relationship with a counsellor or other professional, but they might need practical help, like help around the house or help sticking to their treatment plan. And others may simply want to be included in some social events. By asking what a person needs, you may also be less tempted to give advice. 
 When people experience an episode of depression, they can have a lot of very negative thoughts and feelings. This can take a real toll on others. It’s a good idea to seek support for yourself—there are support groups just for family members and friends. The BC Schizophrenia Society has a directory of family support groups around BC for any mental illness. 
 If your loved one isn’t happy with their treatment or would like to try a different option, you can also help them seek different resources or services. You can find general advice in the Ask Us section of HeretoHelp. To find local services, call the BC Mental Health Support Line at 310-6789 (no area code) or email us. 
 This is very important! You are not responsible for your loved one’s treatment (unless your loved one is your child under 19)—but you can support them as they work towards recovery. In most cases, your loved one’s treatment and recovery plans are their choice—you are there to offer support and encouragement. 
 In order for any treatment to work, your loved one needs to be actively involved. Forcing or threatening treatment generally doesn’t work and will only hurt everyone involved. In most cases, anyone 19 years of age and older is free to make their own choices. And their choices may include refusing treatment or choosing a treatment you disagree with. It’s important to be respectful and keep honest communication open between you. You can learn more about dealing with this situation in Ask Us: An adult in my life seems ill and won’t find help. What can I do? 
 If your loved one says that they have thoughts of ending their life, it’s important to take action. Call 1-800-SUICIDE (1-800-784-2433) at any time or message online at www.crisiscentrechat.ca between noon and 1am. If you think your loved one is in immediate danger, you can always call 911 or go to a hospital emergency room.",someone love diagnosed depression help,naturally want help loved one ’ feeling well help may seem fairly obvious loved one experiences physical health problem many people say ’ sure best help loved one experiences mental illness like depression tips ’ understand exactly someone else experiencing need recognize ’ difficult experience try something like “ see experience symptoms really painful ” “ ’ sorry hear ’ feeling unwell. ” experienced depression might say “ know feel. ” remember everyone experiences illnesses like depression differently empathy recognizing impact illness comparing symptoms ’ expert learning depression help understand ’ going maybe dispel unhelpful myths around depression depression info sheet great place start list resources q learn depression sometimes talking problems concerns really help—in fact many people experience mood disorder say want heard ’ important understand talking something difficult like experiences depression hard loved one force talk invite create safe quiet spaces talk loved one opens listen actively—that without distractions like phone tv really pay attention say listen empathy without judgement even ’ understand problem see problem different way main concern distress difficult feelings loved one experiencing find in-depth tips listening communicating well module three family toolkit people ready talk everything ’ okay respect loved one ’ boundaries let tell ’ ready talk even best intentions unsolicited advice unhelpful likely ’ fix problem may know whole story ’ like share worked similar situation ask person would like talk strategies worked different people need different things—don ’ assume know ’ best people need emotional help like someone talk people may good relationship counsellor professional might need practical help like help around house help sticking treatment plan others may simply want included social events asking person needs may also less tempted give advice people experience episode depression lot negative thoughts feelings take real toll others ’ good idea seek support yourself—there support groups family members friends bc schizophrenia society directory family support groups around bc mental illness loved one ’ happy treatment would like try different option also help seek different resources services find general advice ask us section heretohelp find local services call bc mental health support line 310-6789 area code email us important responsible loved one ’ treatment unless loved one child 19 —but support work towards recovery cases loved one ’ treatment recovery plans choice—you offer support encouragement order treatment work loved one needs actively involved forcing threatening treatment generally ’ work hurt everyone involved cases anyone 19 years age older free make choices choices may include refusing treatment choosing treatment disagree ’ important respectful keep honest communication open learn dealing situation ask us adult life seems ill ’ find help loved one says thoughts ending life ’ important take action call 1-800-suicide 1-800-784-2433 time message online www.crisiscentrechat.ca noon 1am think loved one immediate danger always call 911 go hospital emergency room,positive
