Question_ID,Questions,Answers,Preprocessed_Questions,Preprocessed_Answers,Sentiment
9630578,How can I find a support group?,"Support groups are a way for people with a common experience to help each other and learn from each other. There are support groups for people with any experience of mental illness, support groups for people with a specific diagnosis, support groups for family members and friends, and more. 
 Support groups are offered by community organizations, mental health service providers, schools, campuses, and support agencies. Here are some general resources to help you find a mental health or substance use related support group in BC: 
 Talk to your mental health care provider. They might be able to make recommendations. 
 The Mood Disorders Association of BC offers a network of peer support groups around the province for people who experience mental illnesses like mood disorders or post-traumatic stress disorder. They also have groups for family and friends. Groups are drop-in. 
 Many Canadian Mental Health Association branches offer support services, including support groups. If your local branch doesn’t have their own program, they can recommend other services in your community. 
 The BC Schizophrenia Society maintains a directory of support groups and other regular events for family members of people with a mental illness. 
 For groups related to alcohol or drug use, call the Alcohol and Drug Information Referral Service at 1-800-663-1441 or 604-660-9382 in the Lower Mainland. 
 For groups in the Lower Mainland, search the Red Book Online. 
 If you are at school or on campus, talk to a school counsellor or your campus’ health and wellness office. 
 For online support, see some suggestions at www.heretohelp.bc.ca/discuss. This can be particularly useful if you don’t have a group in your community or have trouble getting to an in-person group. 
 In order to benefit the most from a support group, you need to feel safe enough to share your experiences and thoughts, and you need to feel comfortable supporting others. It can be helpful to contact the group facilitator or organizer ahead of time to see if a particular group might be a good fit for you. We have a checklist to help you evaluate support groups—including when it might be time to leave one. 
 Sometimes a group just doesn’t work for you, and that’s okay. If you feel comfortable, you can try talking to the facilitator to see if they can recommend another group that you can try.",find support group,support groups way people common experience help learn support groups people experience mental illness support groups people specific diagnosis support groups family members friends support groups offered community organizations mental health service providers schools campuses support agencies general resources help find mental health substance use related support group bc talk mental health care provider might able make recommendations mood disorders association bc offers network peer support groups around province people experience mental illnesses like mood disorders post-traumatic stress disorder also groups family friends groups drop-in many canadian mental health association branches offer support services including support groups local branch ’ program recommend services community bc schizophrenia society maintains directory support groups regular events family members people mental illness groups related alcohol drug use call alcohol drug information referral service 1-800-663-1441 604-660-9382 lower mainland groups lower mainland search red book online school campus talk school counsellor campus ’ health wellness office online support see suggestions www.heretohelp.bc.ca/discuss particularly useful ’ group community trouble getting in-person group order benefit support group need feel safe enough share experiences thoughts need feel comfortable supporting others helpful contact group facilitator organizer ahead time see particular group might good fit checklist help evaluate support groups—including might time leave one sometimes group ’ work ’ okay feel comfortable try talking facilitator see recommend another group try,positive
1585622,Where can I find child and youth mental health services?,"To find help for a child or youth, you can: 
 Encourage your child to talk to a teacher or school counsellor 
 Talk to your family doctor or pediatrician, or go to a walk-in clinic 
 Contact your local Child & Youth Mental Health office on one of their walk-in days 
 Use Kelty Mental Health’s Help Finder Tool to find specific services and providers 
 Contact the Institute of Families for Child and Youth Mental Health’s Youth-in-Residence or Parent-in-Residence for guidance, information, and support. Youth-in-Residence and Parents-in-Residence are located around the province. If you don’t have one in your community, a Parent- or Youth-in-Residence at the Kelty Mental Health Resource Centre can help you by phone or email 
 Visit www.familysmart.ca for information and resources on child and youth mental health 
 For young people ages 12-24, visit foundrybc.ca to see if there is a Foundry Centre in your area. Foundry offers easy-to-access mental health care, physical health care, social services, and support out of one office.",find child youth mental health services,find help child youth encourage child talk teacher school counsellor talk family doctor pediatrician go walk-in clinic contact local child youth mental health office one walk-in days use kelty mental health ’ help finder tool find specific services providers contact institute families child youth mental health ’ youth-in-residence parent-in-residence guidance information support youth-in-residence parents-in-residence located around province ’ one community parent- youth-in-residence kelty mental health resource centre help phone email visit www.familysmart.ca information resources child youth mental health young people ages 12-24 visit foundrybc.ca see foundry centre area foundry offers easy-to-access mental health care physical health care social services support one office,neutral
1833460,Where can older adults find help for mental health concerns?,"Mental health concerns are a serious concern at any age, and everyone deserves help and support. If you’re concerned about your mental health, you can: 
 Talk to your family doctor or go to a walk-in clinic 
 Call the Mental Health Support Line at 310-6789 (no area code) for information about services in your area 
 Find your local mental health centre or program at www.gov.bc.ca/mentalhealth (you may need a doctor’s referral to access some programs) 
 Find your local Canadian Mental Health Association branch at www.cmha.bc.ca and ask for information about local services 
 Contact a local senior’s support organization or group and ask for advice. You can search for organizations at www.bc211.ca 
 For general information about senior’s mental health: 
 Find resources from the Canadian Coalition for Seniors' Mental Health at www.ccsmh.ca 
 Find info sheets in the Seniors and Depression Series at www.heretohelp.bc.ca/factsheet/seniors-and-depression-series 
 If you are concerned about a loved one: 
 Be honest about your concerns, like changes you’ve noticed or problems that have come up 
 Give your loved one a chance to talk about their perspectives. They may have a different take on the problem or have different priorities in their health care 
 Be patient—it will probably take more than one conversation 
 Whenever possible, aim for cooperation. Focus on finding an action or solution that everyone can agree on 
 Remember that asking for help is hard for many of us, and it can be even harder as people’s roles and abilities change. If your loved one isn’t willing to talk about their experiences with you right away, offer alternatives like the BC Mental Health Support Line (310-6789—no area code needed), the Seniors Distress Line (604-872-1234) or a local seniors support organization (search for organizations at www.bc211.ca) 
 Seek support to manage your expectations and your own well-being. It can be very stressful to see a loved one experience health problems. But adults who can care for themselves and aren’t at risk of harm are free to make their own choices—and that includes refusing help",older adults find help mental health concerns,mental health concerns serious concern age everyone deserves help support ’ concerned mental health talk family doctor go walk-in clinic call mental health support line 310-6789 area code information services area find local mental health centre program www.gov.bc.ca/mentalhealth may need doctor ’ referral access programs find local canadian mental health association branch www.cmha.bc.ca ask information local services contact local senior ’ support organization group ask advice search organizations www.bc211.ca general information senior ’ mental health find resources canadian coalition seniors mental health www.ccsmh.ca find info sheets seniors depression series www.heretohelp.bc.ca/factsheet/seniors-and-depression-series concerned loved one honest concerns like changes ’ noticed problems come give loved one chance talk perspectives may different take problem different priorities health care patient—it probably take one conversation whenever possible aim cooperation focus finding action solution everyone agree remember asking help hard many us even harder people ’ roles abilities change loved one ’ willing talk experiences right away offer alternatives like bc mental health support line 310-6789—no area code needed seniors distress line 604-872-1234 local seniors support organization search organizations www.bc211.ca seek support manage expectations well-being stressful see loved one experience health problems adults care ’ risk harm free make choices—and includes refusing help,positive
6981545,Where can I find self-help materials for depression?,"Self-help resources are not a substitute for diagnosis or treatment. If you have concerns about low mood, it’s best to talk to your doctor first and rule out physical causes for your symptoms. However, once you’ve checked in with your doctor, self-help materials can be a great way to learn more about depression and practice different skills at your own pace or in between treatment sessions. Here are some resources to check out. 
 The Antidepressant Skills Workbook was created by two BC psychologists. You’ll learn more about depression, learn and practice different skills to help improve your mood, and learn how healthy changes in other parts of your life can impact your mood. They also have similar workbooks for specific groups: 
 Dealing With Depression: Antidepressant Skills for Teens 
 A workbook for people who experience problems with depression at work called Antidepressant Skills at Work: Dealing with Mood Problems in the Workplace 
 A workbook for expecting or new moms called Managing Depression: A Self-help Skills Resource for Women Living With Depression During Pregnancy, After Delivery and Beyond 
 A workbook for people who experience health problems called Positive Coping with Health Conditions: A Self-Care Workbook 
 On the HeretoHelp site, our Managing Depression series offers three info sheets: Dealing with a Diagnosis of Depression, Working With Your Doctor for Depression, and Preventing Relapse of Depression. The series helps you be an active partner in your health care, build healthy coping skills and self-management strategies, and more. 
 Often depression can affect your concentration and motivation to work through self-help materials on your own. If you’d like self-help materials with a bit of extra support from a person, Bounce Back: Reclaim Your Health is a guided self-help program for British Columbians who experience mild to moderate depression, low mood, stress, or anxiety. You can get a DVD of tips to help you recognize and manage symptoms of depression, or you can learn more in-depth skills in a series of workbooks you complete at home. You also work with a trained coach from the Canadian Mental Health Association who will offer support and advice by telephone or video conference. Bounce Back is free with a doctor’s referral. For more information, visit www.bouncebackbc.ca (If you want to access the Bounce Back materials without a coach or referral, you can do that online in BC at www.bouncebackonline.ca). 
 The Mood Disorders Association of BC has a number of videos on mental health, seeking help, and other topics 
 Kelty Mental Health Resource Centre also maintains a comprehensive list of websites, toolkits, books and other resources for young people and families 
 Heads Up Guys offer tips and strategies for healthy living strategies for men who experience depression 
 The BC Reproductive Mental Health Program of BC Mental Health and Substance Use Services has a self-management guide for women who experience postpartum depression called Coping with Depression in Pregnancy and Following the Birth. They also have a guide for Aboriginal women and their families called Celebrating the Circle of Life: coming back to Balance and Harmony 
 The follow resources are based outside of BC, but they offer a lot of good information. 
 MoodGYM Training Program is a web-based self-help course for people who experience depression. It is based in Australia but is available for free to anyone 
 Moodjuice is a UK initiative that offers self-help workbooks, including one for depression 
 There are many books and workbooks available to help people who experience depression. Talk to your mental health care team for recommendations. You can find many from your local bookstore or special bookstores specializing in mental health like Odin Books in Vancouver (you can also order online). Within British Columbia, you may also borrow books for free from the Family Support and Resource Centre at BC Children’s and Women’s Hospitals. They have many self-help and reference materials on depression for women and their partners, for parents, and for children and youth.",find self-help materials depression,self-help resources substitute diagnosis treatment concerns low mood ’ best talk doctor first rule physical causes symptoms however ’ checked doctor self-help materials great way learn depression practice different skills pace treatment sessions resources check antidepressant skills workbook created two bc psychologists ’ learn depression learn practice different skills help improve mood learn healthy changes parts life impact mood also similar workbooks specific groups dealing depression antidepressant skills teens workbook people experience problems depression work called antidepressant skills work dealing mood problems workplace workbook expecting new moms called managing depression self-help skills resource women living depression pregnancy delivery beyond workbook people experience health problems called positive coping health conditions self-care workbook heretohelp site managing depression series offers three info sheets dealing diagnosis depression working doctor depression preventing relapse depression series helps active partner health care build healthy coping skills self-management strategies often depression affect concentration motivation work self-help materials ’ like self-help materials bit extra support person bounce back reclaim health guided self-help program british columbians experience mild moderate depression low mood stress anxiety get dvd tips help recognize manage symptoms depression learn in-depth skills series workbooks complete home also work trained coach canadian mental health association offer support advice telephone video conference bounce back free doctor ’ referral information visit www.bouncebackbc.ca want access bounce back materials without coach referral online bc www.bouncebackonline.ca mood disorders association bc number videos mental health seeking help topics kelty mental health resource centre also maintains comprehensive list websites toolkits books resources young people families heads guys offer tips strategies healthy living strategies men experience depression bc reproductive mental health program bc mental health substance use services self-management guide women experience postpartum depression called coping depression pregnancy following birth also guide aboriginal women families called celebrating circle life coming back balance harmony follow resources based outside bc offer lot good information moodgym training program web-based self-help course people experience depression based australia available free anyone moodjuice uk initiative offers self-help workbooks including one depression many books workbooks available help people experience depression talk mental health care team recommendations find many local bookstore special bookstores specializing mental health like odin books vancouver also order online within british columbia may also borrow books free family support resource centre bc children ’ women ’ hospitals many self-help reference materials depression women partners parents children youth,negative
2115228,Where can I find self-help materials for anxiety?,"Self-help resources are not a substitute for diagnosis or treatment. If you have concerns about low mood, it’s best to talk to your doctor first and rule out physical causes for your symptoms. However, once you’ve checked in with your doctor, self-help materials can be a great way to learn more about anxiety and practice different skills at your own pace or in between treatment sessions. Here are some resources to check out: 
 Anxiety Canada has self-help resources, toolkits, worksheets, and videos on anxiety and anxiety disorders for children and their parents, teens, adults, expecting and new moms at www.anxietycanada.com. Their MindShift app teaches skills to help users manage anxiety, relax, and live well. Although designed for teens and young adults, other adults can also benefit from it. 
 Kelty Mental Health Resource Centre has a list of recommended websites, toolkits, books, and other resources for children and for teens. 
 The BC Reproductive Mental Health Program of BC Mental Health and Substance Use Services has a self-management guide for women who experience anxiety during and after birth called Coping With Anxiety During Pregnancy and Following the Birth. 
 Moodjuice is a UK program that offers self-help and information on a number of mental health concerns, including their anxiety self-help guide. If you’d like help for a specific anxiety disorder, visit www.moodjuice.scot.nhs.uk to search for other guides. 
 There are many books and workbooks available to help people who experience anxiety problems. Talk to your mental health. Talk to your mental health care team for recommendations. There are bookstores that specialize in mental health and well-being materials, such as Odin Books in Vancouver. Within British Columbia, you may also borrow books for free from the Family Support and Resource Centre at BC Children’s and Women’s Hospitals. They have many self-help and reference materials on depression for women and their partners, for parents, and for children and youth. 
 If you’d like self-help materials with a bit of extra support from a person, Bounce Back: Reclaim Your Health is a guided self-help program for British Columbians who experience mild to moderate low mood or anxiety. You can get a DVD of tips to help you recognize and manage symptoms of anxiety, or you can learn more in-depth skills in a series of workbooks you complete at home. You work with a trained coach from the Canadian Mental Health Association who will offer support and advice by telephone or video conference. Bounce Back is free with a doctor’s referral. For more information, visit www.bouncebackbc.ca. If you want to access the Bounce Back materials without a coach or referral, you can do that online in BC at www.bouncebackonline.ca.",find self-help materials anxiety,self-help resources substitute diagnosis treatment concerns low mood ’ best talk doctor first rule physical causes symptoms however ’ checked doctor self-help materials great way learn anxiety practice different skills pace treatment sessions resources check anxiety canada self-help resources toolkits worksheets videos anxiety anxiety disorders children parents teens adults expecting new moms www.anxietycanada.com mindshift app teaches skills help users manage anxiety relax live well although designed teens young adults adults also benefit kelty mental health resource centre list recommended websites toolkits books resources children teens bc reproductive mental health program bc mental health substance use services self-management guide women experience anxiety birth called coping anxiety pregnancy following birth moodjuice uk program offers self-help information number mental health concerns including anxiety self-help guide ’ like help specific anxiety disorder visit www.moodjuice.scot.nhs.uk search guides many books workbooks available help people experience anxiety problems talk mental health talk mental health care team recommendations bookstores specialize mental health well-being materials odin books vancouver within british columbia may also borrow books free family support resource centre bc children ’ women ’ hospitals many self-help reference materials depression women partners parents children youth ’ like self-help materials bit extra support person bounce back reclaim health guided self-help program british columbians experience mild moderate low mood anxiety get dvd tips help recognize manage symptoms anxiety learn in-depth skills series workbooks complete home work trained coach canadian mental health association offer support advice telephone video conference bounce back free doctor ’ referral information visit www.bouncebackbc.ca want access bounce back materials without coach referral online bc www.bouncebackonline.ca,negative
