Question_ID,Questions,Answers,Preprocessed_Questions,Preprocessed_Answers,Sentiment
1590140,What does it mean to have a mental illness?,"Mental illnesses are health conditions that disrupt a person's thoughts, emotions, relationships, and daily functioning.",mean mental illness,mental illnesses health conditions disrupt person 's thoughts emotions relationships daily functioning,negative
2110618,Who does mental illness affect?,"Mental illness does can affect anyone, regardless of gender, age, income, social status, ethnicity, religion, sexual orientation, or background.",mental illness affect,mental illness affect anyone regardless gender age income social status ethnicity religion sexual orientation background,negative
9434130,What are some of the warning signs of mental illness?,Symptoms of mental health disorders vary depending on the type and severity of the condition.,warning signs mental illness,symptoms mental health disorders vary depending type severity condition,negative
7657263,Can people with mental illness recover?,"When healing from mental illness, early identification and treatment are of vital importance. ",people mental illness recover,healing mental illness early identification treatment vital importance,negative
1619387,What should I do if I know someone who appears to have the symptoms of a mental disorder?,We encourage those with symptoms to talk to their friends and family members and seek the counsel of a mental health professional.,know someone appears symptoms mental disorder,encourage symptoms talk friends family members seek counsel mental health professional,negative
1030153,How can I find a mental health professional for myself or my child?,Feeling comfortable with the professional you or your child is working with is critical to the success of the treatment.,find mental health professional child,feeling comfortable professional child working critical success treatment,neutral
8022026,What treatment options are available?,Different treatment options are available for individuals with mental illness.,treatment options available,different treatment options available individuals mental illness,neutral
1155199,"If I become involved in treatment, what do I need to know?",It is important to be as involved and engaged in the treatment process as possible.,become involved treatment need know,important involved engaged treatment process possible,neutral
7760466,What is the difference between mental health professionals?,"There are many types of mental health professionals. The variety of providers and their services may be confusing. Each have various levels of education, training, and may have different areas of expertise. Finding the professional who best fits your needs may require some research.",difference mental health professionals,many types mental health professionals variety providers services may confusing various levels education training may different areas expertise finding professional best fits needs may require research,neutral
2553795,How can I find a mental health professional right for my child or myself?,Feeling comfortable with the professional you or your child is working with is critical to the success of your treatment. Finding the professional who best fits your needs may require some research.,find mental health professional right child,feeling comfortable professional child working critical success treatment finding professional best fits needs may require research,neutral
1259439,If I become involved in treatment what do I need to know?,It is important to continue involvement in the treatment process as much as possible.,become involved treatment need know,important continue involvement treatment process much possible,neutral
4197817,Where else can I get help?,"family member, friend, clergy, healthcare provider, or other professionals",else get help,family member friend clergy healthcare provider professionals,positive
3388962,What should I know before starting a new medication?,The best source of information regarding medications is the physician prescribing them,know starting new medication,best source information regarding medications physician prescribing,neutral
5343181,"If I feel better after taking medication, does this mean I am ""cured"" and can stop taking it?",Create a plan for switching to a different treatment that will be a better fit.,feel better taking medication mean `` cured '' stop taking,create plan switching different treatment better fit,positive
5778437,How can I get help paying for my medication?,Visit Healthfinder.gov to learn more.,get help paying medication,visit healthfinder.gov learn,positive
9541219,Where can I go to find therapy,Several different types of treatment and therapy that can help.,go find therapy,several different types treatment therapy help,neutral
3268009,Where can I learn about types of mental health treatment?,"Mental health conditions are often treated with medication, therapy or a combination of the two.",learn types mental health treatment,mental health conditions often treated medication therapy combination two,neutral
3340726,What are the different types of mental health professionals?,There are many types of mental health professionals. Finding the right one for you may require some research.,different types mental health professionals,many types mental health professionals finding right one may require research,neutral
9539480,Where can I go to find a support group?,Many people find peer support a helpful tool that can aid in their recovery. ,go find support group,many people find peer support helpful tool aid recovery,positive
4211025,Where can I go to find inpatient care?,"Inpatient care can help people stabilize on new medications, adjust to new symptoms, or get the help they need.",go find inpatient care,inpatient care help people stabilize new medications adjust new symptoms get help need,positive
4031860,Where can I go to find other local services?,"There are likely plenty of resources that can be used to help you find mental health treatment in your community. These resources can help you find the right therapist, and enable you to better understand viable treatment options and the treatment process.",go find local services,likely plenty resources used help find mental health treatment community resources help find right therapist enable better understand viable treatment options treatment process,neutral
5215843,Where can I learn more information about clinical trials?,"Sometimes, consumers of mental health services may consider participating in a research study when they have not experienced improvement despite having tried a variety of medications and treatments. Research studies (also known as clinical trials) may involve the use of new medications or new treatment approaches whose safety and effectiveness is being tested. While we support innovation in the field, consumers should be cautioned that there are risks associated with clinical trials – make sure you’re aware of them before you enroll.",learn information clinical trials,sometimes consumers mental health services may consider participating research study experienced improvement despite tried variety medications treatments research studies also known clinical trials may involve use new medications new treatment approaches whose safety effectiveness tested support innovation field consumers cautioned risks associated clinical trials – make sure ’ aware enroll,neutral
8927672,Where can I learn more information about creating a Psychiatric Advance Directive?,"Similar to a medical advance directive or a health care power of attorney, a psychiatric advance directive is a legal document completed in a time of wellness that provides instructions regarding treatment or services one wishes to have or not have during a mental health crisis, and may help influence his or her care.",learn information creating psychiatric advance directive,similar medical advance directive health care power attorney psychiatric advance directive legal document completed time wellness provides instructions regarding treatment services one wishes mental health crisis may help influence care,positive
7728364,What is mental health?,"We all have mental health which is made up of our beliefs, thoughts, feelings and behaviours.",mental health,mental health made beliefs thoughts feelings behaviours,neutral
4194958,What do I do if the support doesn’t help?,"It can be difficult to find the things that will help you, as different things help different people. It's important to be open to a range of approaches and to be committed to finding the right help and to continue to be hopeful, even when some things don't work out.",support ’ help,difficult find things help different things help different people 's important open range approaches committed finding right help continue hopeful even things n't work,positive
1667863,Can you prevent mental health problems?,"We can all suffer from mental health challenges, but developing our wellbeing, resilience, and seeking help early can help prevent challenges becoming serious.",prevent mental health problems,suffer mental health challenges developing wellbeing resilience seeking help early help prevent challenges becoming serious,negative
8904276,Are there cures for mental health problems?,"It is often more realistic and helpful to find out what helps with the issues you face. Talking, counselling, medication, friendships, exercise, good sleep and nutrition, and meaningful occupation can all help.",cures mental health problems,often realistic helpful find helps issues face talking counselling medication friendships exercise good sleep nutrition meaningful occupation help,negative
4283807,What causes mental health problems?,"Challenges or problems with your mental health can arise from psychological, biological, and social, issues, as well as life events.",causes mental health problems,challenges problems mental health arise psychological biological social issues well life events,negative
8690253,What do I do if I’m worried about my mental health?,"The most important thing is to talk to someone you trust. This might be a friend, colleague, family member, or GP. In addition to talking to someone, it may be useful to find out more information about what you are experiencing. These things may help to get some perspective on what you are experiencing, and be the start of getting help.",’ worried mental health,important thing talk someone trust might friend colleague family member gp addition talking someone may useful find information experiencing things may help get perspective experiencing start getting help,negative
2973656,How do I know if I’m unwell?,"If your beliefs , thoughts , feelings or behaviours have a significant impact on your ability to function in what might be considered a normal or ordinary way, it would be important to seek help.",know ’ unwell,beliefs thoughts feelings behaviours significant impact ability function might considered normal ordinary way would important seek help,neutral
4759773,What should I do if I’m worried about a friend or relative?,This may depend on your relationship with them. Gently encouraging someone to seek appropriate support would be helpful to start with.,’ worried friend relative,may depend relationship gently encouraging someone seek appropriate support would helpful start,positive
1511075,How do I deal with someone telling me what to do?,"Some people may advise you on good evidence of what works with the best of intentions, but it's important to find out what works best for you.",deal someone telling,people may advise good evidence works best intentions 's important find works best,neutral
7069853,Why do I need to keep informed?,"It may be tempting to try to block out the world altogether to avoid bad news, but it's important to keep yourself informed. We all have to step up during a pandemic because we all have a part to play in reducing the spread of the virus. It's important that you know what must be done and how you should do it. This is important for the health of your neighbours and your own mental health, and taking action can help counter difficult feelings like hopelessness and despair. 
 One study from people in China found that people who had reliable up-to-date information about the coronavirus and COVID-19 illness and accurate instructions on how they should act (such as instructions around hand-washing and wearing a mask) felt more resilient and felt better able to handle the virus. People who received good, accurate information reported lower levels of stress, anxiety, and depression. This research is available for free at www.mdpi.com/1660-4601/17/5/1729. 
 Of course, it's okay to set limits. Staying informed does not mean that you have to follow the news all day. Check in a few times a day, sticking to trusted sources and media outlets. While social media can be a great way to keep in touch with family and friends, social media can also amplify bad advice, vague or untrue stories, and other unhelpful information. Be sure to use good critical thinking skills.",need keep informed,may tempting try block world altogether avoid bad news 's important keep informed step pandemic part play reducing spread virus 's important know must done important health neighbours mental health taking action help counter difficult feelings like hopelessness despair one study people china found people reliable up-to-date information coronavirus covid-19 illness accurate instructions act instructions around hand-washing wearing mask felt resilient felt better able handle virus people received good accurate information reported lower levels stress anxiety depression research available free www.mdpi.com/1660-4601/17/5/1729 course 's okay set limits staying informed mean follow news day check times day sticking trusted sources media outlets social media great way keep touch family friends social media also amplify bad advice vague untrue stories unhelpful information sure use good critical thinking skills,neutral
4181750,How can I tell if health information is good or bad?,"Anyone can post anything online. It's up to the readers to think critically about information to decide if it seems helpful, truthful, or safe. Here are key points to keep in mind as you determine which information is worth considering and which information doesn't pass the test. 
 It's so easy to spread information online, and we can't assume that the source we're reading or watching is the original source. Before you can evaluate anything, you need to know where the claims come from and determine if it's a reliable source. 
 Reliable sources on the coronavirus and COVID-19 illness include the World Health Organization (WHO), Government of Canada ministries and agencies like Health Canada and the Public Health Agency of Canada, the Government of BC ministries and agencies like the BC Ministry of Health, and the BC Centre for Disease Control (BCCDC). Scientists and researchers at universities and other institutions and health sciences professionals are also important sources of information. 
 Headlines and titles need to be simple and short, so they can sometimes be misleading on their own. They may also be purposefully shocking or controversial to entice you to click to read more. 
 Websites that belong to governments, government-funded agencies, well-known health providers, universities, or groups of medical professionals are generally the most reliable. Be careful of sites that don't list the author or don't tell you much about themselves. Double-check the author and the credentials of any 'experts' quoted or cited to see if they are actually experts in the topic being discussed. 
 Can you find other evidence from other sources to support the claims? Does the author list their sources? Are the sources legitimate, like research journals? 
 Unhelpful sources want you to feel a certain way: scared, angry, distrustful, vulnerable. Phrases like ""Skyrocketing rates of infection"" are sensational and they're meant to make people feel afraid. On the other hand, factual statements like ""We have 50 new cases in BC"" give you important information without playing into your emotions. Helpful news or information sources want you feel informed and empowered. 
 Who is paying for the site? What products or services are being advertised? What links or other sites do they promote? Are you learning something from a story or experience, or are you simply being directed to buy a product or service? 
 Social media can be a great way to keep in touch with family and friends, especially as we practice physical distancing or self-isolation. Social media can also be an important way to learn from health experts and connect to support services and mutual aid groups in your community. 
 Like any other source of information, it's important to use good critical thinking skills when you use social media. Studies find that searching for health information on social media generally has very mixed results. You'll see both very poor-quality sources next to good-quality sources, and it's up to you to decide which is which. In addition, social media posts tend to be short and rarely capture everything you need to consider. They are generally useful as a way to start learning or exploring different points of view rather than a place to gather all the information. 
 Visit www.mediasmarts.ca to learn more about digital and media literacy 
 Visit www.healthnewsreview.org to learn more about thinking critically around health claims (this resource is no longer updated daily, but all toolkits and lessons are still available) 
 This page is adapted from the Evaluating Mental Health and Substance Use Information info sheet.",tell health information good bad,anyone post anything online 's readers think critically information decide seems helpful truthful safe key points keep mind determine information worth considering information n't pass test 's easy spread information online ca n't assume source 're reading watching original source evaluate anything need know claims come determine 's reliable source reliable sources coronavirus covid-19 illness include world health organization government canada ministries agencies like health canada public health agency canada government bc ministries agencies like bc ministry health bc centre disease control bccdc scientists researchers universities institutions health sciences professionals also important sources information headlines titles need simple short sometimes misleading may also purposefully shocking controversial entice click read websites belong governments government-funded agencies well-known health providers universities groups medical professionals generally reliable careful sites n't list author n't tell much double-check author credentials 'experts quoted cited see actually experts topic discussed find evidence sources support claims author list sources sources legitimate like research journals unhelpful sources want feel certain way scared angry distrustful vulnerable phrases like `` skyrocketing rates infection '' sensational 're meant make people feel afraid hand factual statements like `` 50 new cases bc '' give important information without playing emotions helpful news information sources want feel informed empowered paying site products services advertised links sites promote learning something story experience simply directed buy product service social media great way keep touch family friends especially practice physical distancing self-isolation social media also important way learn health experts connect support services mutual aid groups community like source information 's important use good critical thinking skills use social media studies find searching health information social media generally mixed results 'll see poor-quality sources next good-quality sources 's decide addition social media posts tend short rarely capture everything need consider generally useful way start learning exploring different points view rather place gather information visit www.mediasmarts.ca learn digital media literacy visit www.healthnewsreview.org learn thinking critically around health claims resource longer updated daily toolkits lessons still available page adapted evaluating mental health substance use information info sheet,negative
2554141,Why do I need a plan?,"There are a lot of things you can't control. You can't control what happens next, how governments respond, or how your neighbours react to the pandemic. What you can do is make a plan and decide how you'll manage the things you do control, like your ability to stay safe, follow public health measures, stay connected with loved ones, and take care of your mental and physical health. 
 Events like a pandemic change a lot over time, and that uncertainty can add to fear and stress. The truth is that we don't know what will happen next—but that doesn't mean we're all helpless. You can do a lot. You can: 
 Map out a daily schedule, including times you can connect with loved ones online or by phone 
 Plan out daily tasks and goals 
 Give yourself a schedule to look up current information 
 Make sure you have 14 days of healthy food and household supplies at home 
 Keep medications on hand and talk to your doctor for advice if you're at increased risk 
 Educate yourself on public health measures and figure out how you'll follow those instructions 
 Figure out how you'll manage increased childcare demands, working for home, or other changes to your usual routine 
 Determine if you'll need financial supports like the Canada Emergency Response Benefit or BC Temporary Rent Supplement if your job is affected by COVID-19. If you anticipate a need, you can find application instructions and gather any documents or other pieces of information ahead of time 
 Figure out how you'll manage times when you feel overwhelmed or hopeless, like calming activities, the number for a local support or crisis line, a video chat with a loved one, or a way to connect with your mental health care provider 
 Look for local support organizations, neighbourhood groups, or mutual aid groups if you need extra help or support or would like to help others in your community 
 Some planning will be straightforward, but you may also encounter situations or times when it's harder to see a solution or good plan of action. This is a great time to practice problem-solving skills. Problem-solving is a method that helps you break down a complicated situation into manageable pieces, look for realistic and unbiased information, brainstorm possible solutions, and test the solutions that you think might work well. Problem-solving is a helpful skill no matter what else is going on in the world, and it's an empowering, methodical approach when you might otherwise feel overwhelmed or lost. 
 Check out the following resources for more information about problem-solving: 
 Wellness Module 4: Problem-Solving: www.heretohelp.bc.ca/wellness-module/wellness-module-4-problem-solving 
 Problem-solving worksheet from Anxiety Canada: www.anxietycanada.com/sites/default/files/ProblemSolving.pdf 
 Effective Problem-Solving in The Antidepressant Skills Workbook: psychhealthandsafety.org/asw",need plan,lot things ca n't control ca n't control happens next governments respond neighbours react pandemic make plan decide 'll manage things control like ability stay safe follow public health measures stay connected loved ones take care mental physical health events like pandemic change lot time uncertainty add fear stress truth n't know happen next—but n't mean 're helpless lot map daily schedule including times connect loved ones online phone plan daily tasks goals give schedule look current information make sure 14 days healthy food household supplies home keep medications hand talk doctor advice 're increased risk educate public health measures figure 'll follow instructions figure 'll manage increased childcare demands working home changes usual routine determine 'll need financial supports like canada emergency response benefit bc temporary rent supplement job affected covid-19 anticipate need find application instructions gather documents pieces information ahead time figure 'll manage times feel overwhelmed hopeless like calming activities number local support crisis line video chat loved one way connect mental health care provider look local support organizations neighbourhood groups mutual aid groups need extra help support would like help others community planning straightforward may also encounter situations times 's harder see solution good plan action great time practice problem-solving skills problem-solving method helps break complicated situation manageable pieces look realistic unbiased information brainstorm possible solutions test solutions think might work well problem-solving helpful skill matter else going world 's empowering methodical approach might otherwise feel overwhelmed lost check following resources information problem-solving wellness module 4 problem-solving www.heretohelp.bc.ca/wellness-module/wellness-module-4-problem-solving problem-solving worksheet anxiety canada www.anxietycanada.com/sites/default/files/problemsolving.pdf effective problem-solving antidepressant skills workbook psychhealthandsafety.org/asw,neutral
