Question_ID,Questions,Answers,Preprocessed_Questions,Preprocessed_Answers,Sentiment
9178453,What is schizoid personality disorder?,"A personality disorder is a pattern of thoughts, feelings, and behaviours that last for a long time and causes some sort of problem or distress. 
 Schizoid personality disorder or SPD affects social interactions and relationships. People with SPD may have a hard time relating to others and showing emotions. They may avoid close relationships and prefer to spend their time alone, seeming distant even to close family members. Many people don’t respond to strong emotions like anger, even when others try to provoke them. On the outside, people with SPD may seem cold or aloof, showing little emotion. 
 While they have a similar name, schizoid personality disorder isn’t the same as schizophrenia. 
 Schizoid personality disorder is believed to be relatively uncommon. While some people with SPD may see it as part of who they are, other people may feel a lot of distress, especially around social interactions. Some medications may help people manage symptoms and psychotherapy may help people build new skills and improve relationships. 
 To find help for schizoid personality disorder, talk to your family doctor, find a psychologist through the BC Psychological Association, or call 811 to talk to a HealthLink BC navigator.",schizoid personality disorder,personality disorder pattern thoughts feelings behaviours last long time causes sort problem distress schizoid personality disorder spd affects social interactions relationships people spd may hard time relating others showing emotions may avoid close relationships prefer spend time alone seeming distant even close family members many people ’ respond strong emotions like anger even others try provoke outside people spd may seem cold aloof showing little emotion similar name schizoid personality disorder ’ schizophrenia schizoid personality disorder believed relatively uncommon people spd may see part people may feel lot distress especially around social interactions medications may help people manage symptoms psychotherapy may help people build new skills improve relationships find help schizoid personality disorder talk family doctor find psychologist bc psychological association call 811 talk healthlink bc navigator,negative
9679704,What is antisocial personality disorder?,"A personality disorder is a pattern of thoughts, feelings, and behaviours that last for a long time and causes some sort of problem or distress. 
 Antisocial personality disorder or ASPD affects the way people think about the rights of others. Someone with ASPD may disregard laws or expectations, lack remorse when they hurt others or break the law, make reckless decisions, and believe they are superior to others. People may see someone with ASPD as overly dramatic, impulsive, manipulative, and deceitful. Some people may appear charming, at least on the surface. Like all mental illnesses, antisocial personality disorder is a spectrum. Some people may only occasionally act out, while others may break the law often and spend a lot of time in the criminal justice system. 
 ASPD is only diagnosed in adults, but people with ASPD start to have problems with conduct or antisocial behaviours at a young age. They may be diagnosed with conduct disorder during childhood. 
 Treatment for antisocial personality disorder, usually psychotherapy, can help reduce the harms of ASPD and help people build empathy towards others. ASPD is treatable and it may improve as a person approaches middle age. 
 All of us have hurt someone else or acted without thinking of others' needed. It’s important to remember that antisocial personality disorder is an enduring pattern around lack of empathy and lack of remorse. Only a doctor or mental health professional can diagnose illnesses like ASPD. 
 To find help for antisocial personality disorder, talk to your family doctor, find a psychologist through the BC Psychological Association, or call 811 to talk to a HealthLink BC navigator.",antisocial personality disorder,personality disorder pattern thoughts feelings behaviours last long time causes sort problem distress antisocial personality disorder aspd affects way people think rights others someone aspd may disregard laws expectations lack remorse hurt others break law make reckless decisions believe superior others people may see someone aspd overly dramatic impulsive manipulative deceitful people may appear charming least surface like mental illnesses antisocial personality disorder spectrum people may occasionally act others may break law often spend lot time criminal justice system aspd diagnosed adults people aspd start problems conduct antisocial behaviours young age may diagnosed conduct disorder childhood treatment antisocial personality disorder usually psychotherapy help reduce harms aspd help people build empathy towards others aspd treatable may improve person approaches middle age us hurt someone else acted without thinking others needed ’ important remember antisocial personality disorder enduring pattern around lack empathy lack remorse doctor mental health professional diagnose illnesses like aspd find help antisocial personality disorder talk family doctor find psychologist bc psychological association call 811 talk healthlink bc navigator,negative
9167296,What is obsessive-compulsive personality disorder?,"A personality disorder is a pattern of thoughts, feelings, and behaviours that last for a long time and causes some sort of problem or distress. 
 Obsessive-compulsive personality disorder or OCPD is about control. People with OCPD have very inflexible thinking and expect everything to be ordered, perfect, and done their ""correct"" way. This happens at the expense of other important things in life, including relationships with others. Work can take priority over every other part of life, too, and people with OCPD may seem excessively dedicated, but may be unable to complete tasks due to perfectionism. They may struggle to delegate and may distrust other people’s contributions. People with OCPD may not tolerate uncertainty and may have a very rigid understanding of the world—something is either right or wrong. They may also have a hard time spending money on themselves or others, and they may experience hoarding, the inability to throw away items from their homes. The conflict between the desire for neatness or order and the inability to throw things out may cause a lot of anxiety. 
 While obsessive-compulsive personality disorder and obsessive-compulsive disorder (OCD) have a similar name, they are not the same illness. People with obsessive-compulsive disorder usually understand that their obsessions and compulsions are illogical and usually experience a lot of distress, even though they may not be able to stop obsessions or compulsions. Compulsions are an attempt to reduce anxiety, not to find pleasure. People with obsessive-compulsive personality disorder may view their thoughts as part of who they are, see their thoughts as logical, and may find pleasure or benefit in completing compulsive tasks. They may experience a lot of distress when they can’t achieve control or the perfectionism they want. 
 Obsessive-compulsive personality disorder is one of the most common personality disorders. Treatment may include some combination of psychotherapy, medication, and self-help strategies. To find help for OCPD, talk to your family doctor, find a psychologist through the BC Psychological Association, or call 811 to talk to a HealthLink BC navigator.",obsessive-compulsive personality disorder,personality disorder pattern thoughts feelings behaviours last long time causes sort problem distress obsessive-compulsive personality disorder ocpd control people ocpd inflexible thinking expect everything ordered perfect done `` correct '' way happens expense important things life including relationships others work take priority every part life people ocpd may seem excessively dedicated may unable complete tasks due perfectionism may struggle delegate may distrust people ’ contributions people ocpd may tolerate uncertainty may rigid understanding world—something either right wrong may also hard time spending money others may experience hoarding inability throw away items homes conflict desire neatness order inability throw things may cause lot anxiety obsessive-compulsive personality disorder obsessive-compulsive disorder ocd similar name illness people obsessive-compulsive disorder usually understand obsessions compulsions illogical usually experience lot distress even though may able stop obsessions compulsions compulsions attempt reduce anxiety find pleasure people obsessive-compulsive personality disorder may view thoughts part see thoughts logical may find pleasure benefit completing compulsive tasks may experience lot distress ’ achieve control perfectionism want obsessive-compulsive personality disorder one common personality disorders treatment may include combination psychotherapy medication self-help strategies find help ocpd talk family doctor find psychologist bc psychological association call 811 talk healthlink bc navigator,negative
9049618,What is binge-eating disorder?,"Binge-eating disorder or BED is a type of eating disorder. It involves episodes of eating a lot of food in a short amount of time, past the point of feeling full, and feelings of being out of control or unable to stop eating. People who experience binge-eating disorder may binge even when they don’t feel hungry. They may feel temporarily comforted by food, and then feel depressed, upset, guilty, or ashamed of their eating. As a result, many people try to keep binge-eating symptoms a secret. You can’t tell if someone experiences binge-eating disorder just from the way they look or the way they eat around others. 
 While a lot of people have the experience of eating too much a few times and feeling uncomfortable after, people who experience binge-eating disorder experience many binges for a long period of time. 
 Binge-eating disorder is treatable. Talk to your doctor or a mental health professional if you think you might have binge-eating disorder.",binge-eating disorder,binge-eating disorder bed type eating disorder involves episodes eating lot food short amount time past point feeling full feelings control unable stop eating people experience binge-eating disorder may binge even ’ feel hungry may feel temporarily comforted food feel depressed upset guilty ashamed eating result many people try keep binge-eating symptoms secret ’ tell someone experiences binge-eating disorder way look way eat around others lot people experience eating much times feeling uncomfortable people experience binge-eating disorder experience many binges long period time binge-eating disorder treatable talk doctor mental health professional think might binge-eating disorder,negative
7984793,What’s the difference between dissociative identity disorder (multiple personality disorder) and schizophrenia?,"Sometimes, people confuse dissociative identity disorder, formerly known as multiple personality disorder, and schizophrenia. Schizophrenia does mean “split mind,” but the name was meant to describe the ‘split’ from reality that you experience during an episode of psychosis, as well as changes in thoughts, emotions, and other functions. Dissociative identity disorder, on the other hand, does cause a split or fragmented understanding of a person’s sense of themselves. 
 Dissociative identity disorder is really more about fragmented identities than many different personalities that develop on their own. Most people see different parts of their being as part of the whole person. For people who experience DID, identity fragments may have very different characteristics, including their own history, identity, and mannerisms. A key part of DID is dissociation—feeling detached to the world around you. People who experience DID may have many unexplainable gaps in their memory, forget information they’re already learned, or have difficulties recalling things they’ve said or done. Unlike portrayals of DID on TV or in movies, DID may not be obvious to others, and it can take a lot of time to come to the diagnosis. 
 Schizophrenia is a serious mental illness that causes hallucinations (sensations that aren’t real) and delusions (beliefs that can’t possibly be true, in addition to other symptoms like jumbled thoughts, jumbled speech, and difficulties expressing emotions. People who experience schizophrenia may hear or feel things that aren’t real or believe things that can’t be real, but these aren’t separate identities.",’ difference dissociative identity disorder multiple personality disorder schizophrenia,sometimes people confuse dissociative identity disorder formerly known multiple personality disorder schizophrenia schizophrenia mean “ split mind ” name meant describe ‘ split ’ reality experience episode psychosis well changes thoughts emotions functions dissociative identity disorder hand cause split fragmented understanding person ’ sense dissociative identity disorder really fragmented identities many different personalities develop people see different parts part whole person people experience identity fragments may different characteristics including history identity mannerisms key part dissociation—feeling detached world around people experience may many unexplainable gaps memory forget information ’ already learned difficulties recalling things ’ said done unlike portrayals tv movies may obvious others take lot time come diagnosis schizophrenia serious mental illness causes hallucinations sensations ’ real delusions beliefs ’ possibly true addition symptoms like jumbled thoughts jumbled speech difficulties expressing emotions people experience schizophrenia may hear feel things ’ real believe things ’ real ’ separate identities,negative
6085633,What's the difference between psychosis and schizophrenia?,"Psychosis is a syndrome or group of symptoms. Someone experiencing an episode of psychosis is having a ‘break’ with reality. Major symptoms of psychosis are hallucinations and delusions. Hallucinations are sensations that are not real, such as hearing voices or sounds that aren’t real. Hearing voices is a common hallucination, but hallucinations can be experiences with any sense—hearing, sight, smell, taste, or touch. Delusions are strong beliefs that can’t possibly be true. Common delusions include the belief that someone is following or monitoring you, or the belief that you have extraordinary powers or abilities. Other symptoms of psychosis include difficulties concentrating, completing tasks, or making decisions. Thoughts may feel ‘jumbled’ or confused. Some people have a hard time following conversations or speaking clearly. Psychosis can even affect the way people move or express their emotions. 
 Schizophrenia is a mental illness that causes psychosis, but schizophrenia also has other symptoms. And it isn’t the only cause of psychosis. In some cases, other mental illnesses cause psychosis, including depression, bipolar disorder, dementia and borderline personality disorder. Psychosis may come up during times of extreme stress, a major lack of sleep, or trauma. People who are using or withdrawing from certain drugs or medications may experience psychosis. Psychosis may also be caused by a brain injury, neurological problem, or other health problem. So while psychosis can be a part of schizophrenia, it can be caused by many other things too. 
 Psychosis and schizophrenia are treatable. It’s important to seek help as soon as possible.",'s difference psychosis schizophrenia,psychosis syndrome group symptoms someone experiencing episode psychosis ‘ break ’ reality major symptoms psychosis hallucinations delusions hallucinations sensations real hearing voices sounds ’ real hearing voices common hallucination hallucinations experiences sense—hearing sight smell taste touch delusions strong beliefs ’ possibly true common delusions include belief someone following monitoring belief extraordinary powers abilities symptoms psychosis include difficulties concentrating completing tasks making decisions thoughts may feel ‘ jumbled ’ confused people hard time following conversations speaking clearly psychosis even affect way people move express emotions schizophrenia mental illness causes psychosis schizophrenia also symptoms ’ cause psychosis cases mental illnesses cause psychosis including depression bipolar disorder dementia borderline personality disorder psychosis may come times extreme stress major lack sleep trauma people using withdrawing certain drugs medications may experience psychosis psychosis may also caused brain injury neurological problem health problem psychosis part schizophrenia caused many things psychosis schizophrenia treatable ’ important seek help soon possible,neutral
1896541,What are positive and negative symptoms?,"Positive and negative symptoms are medical terms for two groups of symptoms in schizophrenia. 
 Positive symptoms add. Positive symptoms include hallucinations (sensations that aren’t real), delusions (beliefs that can’t be real), and repetitive movements that are hard to control. 
 Negative symptoms take away. Negative symptoms include the inability to show emotions, apathy, difficulties talking, and withdrawing from social situations and relationships. 
 There is also a third group of symptoms, usually called cognitive symptoms. This includes anything related to thinking, such as disorganized thoughts, memory problems, and difficulties with focus and attention.",positive negative symptoms,positive negative symptoms medical terms two groups symptoms schizophrenia positive symptoms add positive symptoms include hallucinations sensations ’ real delusions beliefs ’ real repetitive movements hard control negative symptoms take away negative symptoms include inability show emotions apathy difficulties talking withdrawing social situations relationships also third group symptoms usually called cognitive symptoms includes anything related thinking disorganized thoughts memory problems difficulties focus attention,neutral
4962901,What is a prodrome?,"Prodrome is a medical term for early signs or symptoms of an illness or health problem that appear before the major signs or symptoms start. 
 Psychosis, a group of symptoms found in disorders like schizophrenia, is one illness with a specific prodrome. With psychosis, prodrome signs and symptoms start before full symptoms like hallucinations and delusions appear. 
 Common symptoms in the prodrome of psychosis include: 
 These symptoms are found in many other mental illnesses, so it isn’t always clear at the time if this is a prodrome of psychosis or schizophrenia or something else. It’s best to seek help whenever you are concerned about your mental health or a loved one’s mental health. Psychosis and schizophrenia are much easier to manage and treat when treatment starts early.",prodrome,prodrome medical term early signs symptoms illness health problem appear major signs symptoms start psychosis group symptoms found disorders like schizophrenia one illness specific prodrome psychosis prodrome signs symptoms start full symptoms like hallucinations delusions appear common symptoms prodrome psychosis include symptoms found many mental illnesses ’ always clear time prodrome psychosis schizophrenia something else ’ best seek help whenever concerned mental health loved one ’ mental health psychosis schizophrenia much easier manage treat treatment starts early,neutral
6869967,I’m an adult and I think I might have ADHD. What can I do next?,"While we think of attention-deficit/hyperactivity disorder as an illness that affects children, it can last into adulthood—and some people aren’t diagnosed until much later in life. 
 ADHD is diagnosed like any other mental illness, so your family doctor is a good place to start. Your family doctor may be able to assess your mental health and start treatment, if needed, or they may refer you to more specialized mental health services. 
 There are a few organizations that can help you find good resources and find some support: 
 The Canadian Attention Deficit Hyperactivity Disorder Resource Alliance (CADDRA) is an organization that supports health professionals who research ADHD, treat and support people diagnosed with ADHD, and trains professionals. In the ‘Public Info’ section of their website, you’ll find more information on adult ADHD and the assessment process. You’ll also find extensive resources and recommended publications. 
 The Centre for ADHD Awareness, Canada provides education and advocacy for Canadians who experience ADHD. They have a section on their website for adults, including information on symptoms and assessments, treatments, ADHD in the workplace, resources, and a reading list. 
 CHADD Vancouver offers a monthly support group for adults in the Vancouver area.",’ adult think might adhd next,think attention-deficit/hyperactivity disorder illness affects children last adulthood—and people ’ diagnosed much later life adhd diagnosed like mental illness family doctor good place start family doctor may able assess mental health start treatment needed may refer specialized mental health services organizations help find good resources find support canadian attention deficit hyperactivity disorder resource alliance caddra organization supports health professionals research adhd treat support people diagnosed adhd trains professionals ‘ public info ’ section website ’ find information adult adhd assessment process ’ also find extensive resources recommended publications centre adhd awareness canada provides education advocacy canadians experience adhd section website adults including information symptoms assessments treatments adhd workplace resources reading list chadd vancouver offers monthly support group adults vancouver area,neutral
